,track_id,track_name,artist_name,genre_id,genre_names,lyrics,lyrics_source
0,201311852,Walang Katulad,Victory Worship,[22],['Christian & Gospel'],"Ika'y aking liwanag
Sa dilim ng landas
Sa bawat kalungkutan
Hawak aking kamay

Imulat Mo ang aking mga mata
Ikaw ang kailangan

Pag-ibig Mo, naririto
Walang katulad
Pagmamahal Mong kay lalim
Walang katulad

Pag-asa't kaligtasan
Gabay at lakas
Lahat ng nilikha Mo'y
Pinupuri Ka

Imulat Mo ang aking mga mata
Ikaw ang kailangan

Pag-ibig Mo, naririto
Walang katulad
Pagmamahal Mong kay lalim
Walang katulad

Itinataas mga kamay
Sa dakila naming Diyos
Walang papantay sa 'Yong pagmamahal, oh-oh
Itinataas mga kamay
Sa dakila naming Diyos
Walang papantay sa 'Yong pagmamahal
Ikaw ang kailangan

Pag-ibig Mo, naririto
Walang katulad
Pagmamahal Mong kay lalim
Walang katulad
Pag-ibig Mo, naririto
Walang katulad
Pagmamahal Mong kay lalim
Walang katulad

Oh-oh, oh-oh-oh",
1,73676809,Shine Upon the Philippines,Victory Worship,[22],['Christian & Gospel'],"You are the light, You are the hope
You are the future of this land
Your loving faithfulness gives us strength
To rise and declare that You are God

You are enthroned deep in our hearts
Declaring Your splendor all day long
Your loving kindness never ceases
For all who call upon Your name

Shine, shine upon the Philippines, O, Lord
Let Your righteousness be known
Everywhere we go
For Your Kingdom is revealed
In the temple of our hearts
One nation bowing down
Worshiping Your name
We cry holy, holy, holy
Holy is the Lord

You are the light, You are the hope
You are the future of this land
Your loving faithfulness gives us strength
To rise and declare that You are God

You are enthroned deep in our hearts
Declaring Your splendor all day long
Your loving kindness never ceases
For all who call upon Your name

Shine, shine upon the Philippines, O, Lord
Let Your righteousness be known
Everywhere we go
For Your Kingdom is revealed
In the temple of our hearts
One nation bowing down
Worshiping Your name
We cry holy, holy, holy
Holy is the Lord

Hesus, tanging Panginoon ng Pilipinas
Ang Iyong kabanalan ang siyang maghahari
Gamitin Mo kaming ilaw sa buong mundo
Upang ang Iyong pangalan
Purihin magpakailanman
Ikaw lamang ang aming pag-asa
At siyang masusunod

Shine, shine upon the Philippines, O, Lord
Let Your righteousness be known
Everywhere we go
For Your Kingdom is revealed
In the temple of our hearts
One nation bowing down
Worshiping Your name
We cry holy, holy, holy
Holy is the Lord
We cry holy, holy, holy
Holy is the Lord
We cry holy, holy
Holy is the Lord",
2,189377564,Pagbabalik,Victory Worship,[22],['Christian & Gospel'],"Ngayon ay aahon, at kakalimutan ang nakaraan
Dilim ng kahapon, isasantabi na at wawakasan

Pagkat ang liwanag ng pag-ibig Mo
Ay ilaw, gabay sa pagbabalik ko

Aawitin ang Iyong katapatan at kadakilaan
Sasayaw sa saliw ng lawak ng Iyong pagmamahal
Lulundag sa lalim ng kabutihan ng Iyong hangarin
O ang lahat ng Iyong mga anak magbabalik sa'Yo, Ama

Ipagdiriwang, at ihahayag ang kalayaan
'Di papaalipin, hindi na muling magpapabihag

At sa bawat sulok ng buong mundo
Ihahayag tanging Pangalan mo

Aawitin ang Iyong katapatan at kadakilaan
Sasayaw sa saliw ng lawak ng Iyong pagmamahal
Lulundag sa lalim ng kabutihan ng Iyong hangarin
O ang lahat ng Iyong mga anak magbabalik sa'Yo, Ama


Ama, walang katulad, ang pangako at pag ibig na alay
Hesus, Ikaw ang Daan, tanging Katotohanan at Buhay
Ama, walang katulad, ang pangako at pag ibig na alay
Hesus, Ikaw ang Daan, tanging Katotohanan at Buhay
Ama, walang katulad, ang pangako at pag ibig na alay
Hesus, Ikaw ang Daan, tanging Katotohanan at Buhay
Lahat ay magagalak


Aawitin ang Iyong katapatan at kadakilaan
Sasayaw sa saliw ng lawak ng Iyong pagmamahal
Lulundag sa lalim ng kabutihan ng Iyong hangarin
O ang lahat ng Iyong mga anak magbabalik sa'Yo, Ama
Magbabalik sa'Yo, Ama
Magbabalik sa'Yo, Ama
Magbabalik sa'Yo, Ama
Magbabalik sa'Yo, Ama",
3,189377568,Tagumpay,Victory Worship,[22],['Christian & Gospel'],"Sa sigaw ng alon, 'di mangangamba
Sa gitna ng dilim, 'di ako mag-iisa
Hindi matatakot, hindi matitinag
Pagkat Ikaw, o Diyos, ang aking pagasa

Wala nang hahanapin pa
Pagkat, o Diyos, sapat Ka na
Pag-ibig Mo, kanlungan ko
Pangako Mo, sandigan ko

Sa sigaw ng alon, 'di mangangamba
Sa gitna ng dilim, 'di ako mag-iisa
Hindi matatakot, hindi matitinag
Pagkat Ikaw, o Diyos, ang aking pagasa

Wala nang hahanapin pa
Pagkat, o Diyos, sapat Ka na
Wala nang hahanapin pa
Pagkat, o Diyos, sapat Ka na
Pag-ibig Mo, kanlungan ko
Pangako Mo, sandigan ko

Narito na, narito na
Ang tagumpay ay narito na
Narito na, narito na
Ang tagumpay ay narito na
Narito na, narito na
Ang tagumpay ay narito na
Narito na, narito na
Ang tagumpay ay narito na
Narito na, narito na
Ang tagumpay ay narito na
Narito na, narito na
Ang tagumpay ay narito na

Wala nang hahanapin pa
Pagkat, o Diyos, sapat Ka na
Wala nang hahanapin pa
Pagkat, o Diyos, sapat Ka na
Pag-ibig Mo, kanlungan ko
Pangako Mo, sandigan ko
Pag-ibig Mo, kanlungan ko
Pangako Mo, sandigan ko",
4,189377567,Maghari,Victory Worship,[22],['Christian & Gospel'],"Sa gitna ng kaguluhan, ang tinig Mo ay hanap
Sa templo Mong banal, may bagong kagalakan

Ang tanging mananatili, ay ang Iyong sinabi
Sa kataas-taasan, ikaw pa rin ang Hari

Dakila at kailanma'y 'di mahihigitan
Ang ngalan Mo ay kaligtasan ko
Ang Iyong kaharian, ang aking adhika
O Diyos dalangin ko'y maghari Ka

Sa gitna ng kaguluhan, ang tinig Mo ay hanap
Sa templo Mong banal, may bagong kagalakan

Ang tanging mananatili, ay ang Iyong sinabi
Sa kataas-taasan, ikaw pa rin ang Hari

Dakila at kailanma'y 'di mahihigitan
Ang ngalan Mo ay kaligtasan ko
Ang Iyong kaharian, ang aking adhika
O Diyos dalangin ko'y maghari Ka


Sundin ang loob Mo, dito sa lupa, tulad ng sa langit
Sa'Yo ang kaharian, kapangyarihan, at kaluwalhatian
Sundin ang loob Mo, dito sa lupa, tulad ng sa langit
Sa'Yo ang kaharian, kapangyarihan, at kaluwalhatian

Dakila at kailanma'y 'di mahihigitan
Ang ngalan Mo ay kaligtasan ko
Ang Iyong kaharian, ang aking adhika
O Diyos dalangin ko'y maghari Ka
Dakila at kailanma'y 'di mahihigitan
Ang ngalan Mo ay kaligtasan ko
Ang Iyong kaharian, ang aking adhika
O Diyos dalangin ko'y maghari Ka


Dakila at kailanma'y 'di mahihigitan
Ang ngalan Mo ay kaligtasan ko
Ang Iyong kaharian, ang aking adhika
O Diyos dalangin ko'y maghari Ka
Dakila at kailanma'y 'di mahihigitan
Ang ngalan Mo ay kaligtasan ko
Ang Iyong kaharian, ang aking adhika
O Diyos dalangin ko'y maghari Ka

Sundin ang loob Mo, dito sa lupa, tulad ng sa langit
Sa'Yo ang kaharian, kapangyarihan, at kaluwalhatian
Sundin ang loob Mo, dito sa lupa, tulad ng sa langit
Sa'Yo ang kaharian, kapangyarihan, at kaluwalhatian

Dakila at kailanma'y 'di mahihigitan
Ang ngalan Mo ay kaligtasan ko
Ang Iyong kaharian, ang aking adhika
O Diyos dalangin ko'y maghari Ka",
5,94442774,Humayo'T Ihayag,Noel Cabangon,[22],['Christian & Gospel'],"Humayo't ihayag (purihin Siya)
At ating ibunyag (awitan Siya)
Pagliligtas ng Dios na sa krus ni Hesus
Ang Syang sa mundoy tumubos

Langit at lupa Siya'y papurihan
Araw at tala Siya'y parangalan
Ating pagdiwang pag-ibig ng Dios sa tanan
(Aleluya)

Halina't sumayaw (buong bayan)
Lukso sabay sigaw (sanlibutan)
Ang ngalan Niyang angkin 'sing ningning ng bituin
Liwanag ng Dios sumaatin

Langit at lupa Siya'y papurihan
Araw at tala Siya'y parangalan
...

",MusixMatch
6,94442781,Panunumpa,Noel Cabangon,[22],['Christian & Gospel'],"Ikaw lamang ang pangakong mahalin
Sa sumapang sa iyo, magpakailan pa man
Yakapin mo bawat sandali
Ang buhay kong sumpang sa 'yo lamang alay

At mapapawi ang takot sa 'kin
Pangakong walang hanggan

Ikaw lamang ang pangakong susundin
Sa takbo, sakdal, liwanagan ang daan
...

",MusixMatch
7,94442772,Tanging Yaman,Noel Cabangon,[22],['Christian & Gospel'],"Ikaw ang aking Tanging Yaman
Na di lubusang masumpungan
Ang nilikha mong kariktan
Sulyap ng 'yong kagandahan

Ika'y hanap sa tuwina
...

",MusixMatch
8,94442779,Sa'Yo Lamang,Noel Cabangon,[22],['Christian & Gospel'],"Puso ko'y binihag mo
Sa tamis ng pagsuyo
Tanggapin yaring alay
Ako'y iyo habang buhay

Anhin pa ang kayamanan
Luho at karangalan
Kung ika'y mapasa'kin
Lahat na nga ay kakamtin

Sa 'yo lamang ang puso ko
...

",MusixMatch
9,101712797,Yawhe Okumama,Adorons L'eternel & Alain Moloto,[22],['Christian & Gospel'],"Yaweh, Yaweh sala, Yaweh sala lolenge na yo, sala
Yaweh, Yaweh sala, Yaweh sala lolenge na yo, sala
Yaweh, Yaweh sala, Yaweh sala lolenge na yo, sala
Yaweh, Yaweh sala, Yaweh sala lolenge na yo, sala
Nzambe na nga aza ko sala eh (Nzambe na
Nga aza ko sala eh) Yaweh, obongi na lokumu.
Nzambe na nga aza ko sala eh (Nzambe na
Nga aza ko sala eh) Yaweh, obongi na lokumu.
Nzambe na nga aza elonga eh (Nzambe na
Nga aza elonga eh) Yaweh, obongi na lokumu.
Nzambe na nga aza elonga eh (Nzambe na
Nga aza elonga eh) Yaweh, obongi na lokumu.
Oza wa nga na zali pe wa yo (Oza wa nga
Na zali pe wa yo) Yaweh, obongi na lokumu.
Oza wa nga na zali pe wa yo (Oza wa nga
Na zali pe wa yo) Yaweh, obongi na lokumu.
Posa na nga eza ko mona yo (Posa na nga
Eza ko mona yo) Yaweh, obongi na lokumu.
...

",MusixMatch
10,83594587,우리는 주의 교회 We Are His Church,마커스,[22],['Christian & Gospel'],"Sadyang kay buti ng ating Panginoon
Magtatapat sa habang panahon
Maging sa kabila ng aking pagkukulang
Biyaya nya'y patuloy na laan

Katulad ng pagsinag ng gintong araw
Patuoy syang nagbibigay tanglaw
Kaya sa puso ko't damdamin
Katapatan nya'y aking pupurihin

...

",MusixMatch
11,84278920,Ang Tanging Alay ko,April Boy Regino,[22],['Christian & Gospel'],"Salamat sa Iyo
Aking Panginoong Hesus
Ako'y inibig Mo
At inangking lubos
Ang tanging alay ko sa Iyo aking Ama
Ay buong buhay ko puso at kaluluwa
Di na makayanang maipagkaloob
...

",MusixMatch
12,34874946,Sa'yo Lamang,Jamie Rivera,"[22, 14]","['Christian & Gospel', 'Pop']","Puso ko'y binihag mo
Sa tamis ng pagsuyo
Tanggapin yaring alay
Ako'y iyo habang-buhay

Aanhin pa ang kayamanan
Luho at karangalan
Kung ika'y mapasa-akin
Lahat na nga ay kakamtin

Sa 'yo lamang ang puso ko
Sa 'yo lamang ang buhay ko
Kalinisan, pagdaralita
Pagtalima, aking sumpa

Tangan kong kalooban
Sa iyo'y nilalaan
Dahil atas ng pagsuyo
Tumalima lamang sa 'yo

Sa 'yo lamang ang puso ko
Sa 'yo lamang ang buhay ko
Kalinisan, pagdaralita
Pagtalima, aking sumpa

Tangan kong kalooban
Sa iyo'y nilalaan
Dahil atas ng pagsuyo
Tumalima lamang sayo ()
Lyrics found here",
13,35385897,Pinagdiriwang (Live),Musikatha,[22],['Christian & Gospel'],"Pasalamatan ang Diyos sa Kanyang sukdulang biyaya

Kagalakan sa puso'y umaapaw
At 'di maisalarawan ng awit at ng sayaw
Sa 'ming buhay ang dulot ay pag-asa
Sa pagtigis ng 'Yong dugo, Hesus
Mga pagkakasala'y napatawad na

Pinagdiriwang namin ang Iyong pagliligtas
Biyaya ng 'Yong kahabagan at pag-ibig Mong wagas
Pinagdiriwang namin ang tagumpay Mo sa krus
Pinagdiriwang Ka namin, oh Hesus (pinagdiriwang)

Yeah, whoo
Lahat ng nagpapasalamat sapagkat siya'y tinubos ni Hesus, sumigaw!

Kagalakan sa puso'y umaapaw
At 'di maisalarawan ng awit at ng sayaw
Sa 'ming buhay ang dulot ay pag-asa
Sa pagtigis ng 'Yong dugo, Hesus
Mga pagkakasala'y napatawad na (pinagdiriwang)
...

",MusixMatch
14,112047037,Tongo Etana,Michel Bakenda,[22],['Christian & Gospel'],"Mokili elingi eyeba wapi Nkolo na bilembo
Aza na Ye musika te, Aza na mutema na nga
Ofanda lokola mukolo lopangu, Ozo konza ndenge Olingi
Nzambe yako betela milolo eza Yo Muana mpate
Kumama nanu Yahwe
Eh Yahwe, Eh Yahwe Kumama
Kumama Nzambe na bomoyi
Eh Yahwe, Eh Yahwe Kumama
Kumama, Kumama, Kumama
Eh Yahwe, Eh Yahwe Kumama
Kumama Yahwe
Eh Yahwe, Eh Yahwe Kumama
Osolalaka na ba nzete
Oyokaka munoko ya ba niama
Nzambe oyo mupepe ezo tosa, eza Yo Nkolo na bilembo
Nzambe Oyo Asalaka moyi, ekomaka pe ya kala te
Tala biloko ya mokili ekoma kokoma ya kala
Kumama nanu Yesu
Eh Yahwe, Eh Yahwe Kumama
Kumama Nzambe na bomoyi
Eh Yahwe, Eh Yahwe Kumama
""(Kumama Yahwe na nga, Kumama)—
Michel Hardy Bakenda
Nayembi Yo nzembo ya bolingo
Eh Yahwe, Eh Yahwe Kumama
Kumama Kumama Kumama
Eh Yahwe, Eh Yahwe Kumama
...

",MusixMatch
15,84278914,Tanging Hiling,April Boy Regino,[22],['Christian & Gospel'],"Nagdarasal nag susumamo
Sanay pakinggan ang panalangin ko
Nakikiusap sana'y tulungan mo
Na tumagal pa ang Buhay Ko
Nalulungkot ako at umiiyak
Bigyan pa ako ng pag asang mabuhay Pa

Tanging Hiling ko lang Panginoong Hesus
Humaba pa sana ang Buhay ko
Di ba't sabi manalig lang ako
Ikaw ang Dakilang manggagamot ko oh...

...

",MusixMatch
16,35385901,Sukdulang Biyaya (Live),Musikatha,[22],['Christian & Gospel'],"Habang hindi karapat-dapat
Pag-ukulan ng habag at wagas Mong pagsinta
Habang walang kakayanan
Masuklian Ka ng mabuti sa lahat Mong ginawa

Niyakap Mo ako sa aking karumihan
Inibig Mo ako ng 'di kayang tumbasan

Oh, Diyos ng katarungan at katuwiran
Na kahit minsa'y 'di nabahiran
Ang kabanala't kalwalhatian
Salamat sa sukdulang biyaya Mo

Oh, Diyos ng pag-ibig na mas malawak pa
Kaysa aking mga pagkakasala
Higit pa sa buhay ko
Salamat sa sukdulang biyaya Mo

Habang hindi karapat-dapat
...

",MusixMatch
17,35385898,Luwalhatiin Ka (Live),Musikatha,[22],['Christian & Gospel'],"Verse
Diyos
Na walang kaparis at banal
Ika'y noon at magpakailanman
Dakila't makapangyarihang...
Diyos
...

",MusixMatch
18,84278916,Hesus,April Boy Regino,[22],['Christian & Gospel'],"Kung nagiisa at nalulumbay
Dahil sa hirap mong itinataglay
Kung kailangan mo ng karamay
Tumawag ka at siyay naghihintay

Siya angyong kailangan
Sandigan, kaibigan mo
Siya ang araw mong lagi
At karamay kung sawi
...

",MusixMatch
19,35385904,Salamat Panginoon (Live),Musikatha,[22],['Christian & Gospel'],"Ikaw ay mabuti bawat sandali
Sa habang buhay ay mananatili
Hindi mapapawi o maikukubli
Maging sa dilim ng gabi

Sandigang matibay ang iyong pangako
Lakas at pag-asa ng aking puso
Hindi na mabilang pagkakataon
Patunay ng katapatan mo

Sa dalamhati at sa kabiguan
Sa pagluha ng pusong nasugatan
Sa pagsubok na iyong pinahihintulutan
Salamat Panginoon

Sa katugunan sa aking dalangin
Sa kalakasang sa'yo nanggagaling
Sa pagtuturo at pagtutuwid mo sa akin
Salamat Panginoon
Salamat
...

",MusixMatch
20,35385909,Sa Biyaya Mo (Live),Musikatha,[22],['Christian & Gospel'],"Aking diyos dakilang manunubos
Buhay ko'y sa 'yo
Kalayaan ko ay binayaran mo
Ng 'yong dugo
Aking diyos biyaya mo'y sukdulan
Papuri ko'y sa 'yo
Sa krus ginapi mo ang kamatayan
Pag-asa ko'y lubos
...

",MusixMatch
21,84278921,Taos Pusong Pasasalamat,April Boy Regino,[22],['Christian & Gospel'],,
22,35385900,Sambahin Ka (Live),Musikatha,[22],['Christian & Gospel'],"Ika'y sadyang kahanga-hanga kahit na ulit-ulitin ko...
Sabihin ko mahirap man isalarawan ang damdamin aawitin ko...
O aking diyos

Kung ang laman ng puso ko'y naawit na
Maging sa kahuli-hulihang hininga ang nais ko'y
...

",MusixMatch
23,35385905,Gantimpala Ko (Live),Musikatha,[22],['Christian & Gospel'],"INTRO: E/
G#- A- E/
B- B (repeat)

Eb Cdim C#m
MARAMI MA'
NG HADLANG SA AKING PAGSUNOD
AT KADALASA'
Y NAPAPAGOD
Eb Cdim C#m
HINDI PAPIPIGIL PATULOY NA MAGLILINGKOD
...

",MusixMatch
24,35385907,Pagsambang Wagas / Sambahin Ka (Live),Musikatha,[22],['Christian & Gospel'],"Pagsambang Wagas
Inaalala ang biyaya't kabutihan Mo
O Diyos muli akong namamangha Sa'yo
Sa pangangailangan ng puso'y kinalinga Mo
...

",MusixMatch
25,35385906,Sa Iyo (Live),Musikatha,[22],['Christian & Gospel'],"Oh Diyos sayong lahat ang pagsamba't luwalhati
Maging ang pinakamainam kong awit ay aawitin sayo

Oh Dios, ang aking isipan ay pagharian mo
...

",MusixMatch
26,113671666,Buhay Ko,Feast Worship,[22],['Christian & Gospel'],"Simple lang ang awit kong ito
Mula sa pusong nagmamahal Sayo
Simple lang ang buhay ko
Wala namang kayamanang maihaharap
Kundi ang yaman ng pusong naghahanap sa Iyo
Na maghandog
Na ang buhay
Buhay kong aking alay
Sa Iyo giliw walang pangarap
Walang pangarap na iba kundi Ikaw lamang
O giliw ko

Simple lang ang awit kong ito
Mula sa pusong nagmamahal sa Iyo
...

",MusixMatch
27,159317756,Langit Ang Aking Nadarama,RM Rodriguez,[22],['Christian & Gospel'],"Ang kailangan ko'y
Ay pag ibig mo
O Diyos sa buhay kong ito
Ang kagalakan mo
Ay kalakasan ko
Ikaw ang nais ko
Ikaw lamang ang pupurihin
Ang pangalan mo'y dadakilain
Wala na sa'yong maihahambing
Ang awit ko'y iyong dinggin
Langit ang aking nadarama
Sa t'wing kapiling ka
Ang puso ko'y sumisigla
Kapag sayo'y sumasamba
Ang kailangan ko'y
...

",MusixMatch
28,83585087,Lupa Man Ay Langit Na Rin,Lito Magnaye,[22],['Christian & Gospel'],"Nakita ko ang tunay na pag-asa
Natagpuan ang tunay na ligaya
Mahal naming panginoon ako'y sumasamba
Pagka't sa piling mo'y walang kasing ganda

Ikaw ang nagturo ng tamang landasin
Sa puso at aking damdamin
Dinggin ang papuri, ang bawat dalangin
Dahil sa 'yo lupa man ay langit na rin
...

",MusixMatch
29,77315287,Diyos Ng Kabutihan,Jesus One Generation,[22],['Christian & Gospel'],"Pawang kabutihan ang nais Mo
Ibinigay Mong buhay ay ganap at husto
Sa landas ng pagbabago
Katuwiran Mo ang lalakaran ko

Pawang kabutihan ang nais Mo
Ibinigay Mong buhay ay ganap at husto
Sa landas ng pagbabago
Katuwiran Mo ang lalakaran ko

Diyos, ang kabutihan Mo ay magpakailanman
Ikaw ang simula at katapusan
Hindi ka nagmamaliw
Katapatan Mo'y walang hanggan
...

",MusixMatch
30,143960337,Hesus Sa Buhay Ko (Live),Jesus One Generation,[22],['Christian & Gospel'],"Sa bawat umagang kay ganda
Simulang magpuri sa Kanya
Itaas ang kamay at umawit na
Sa bawat araw na dumaraan
Panginoon, Ikaw ang dahilan
Sa lahat ng ligaya at bawat ngiti

Mula sa labi kong nagpupuri
Mula sa labi kong nagpupuri

Hesus sa buhay ko'y Ikaw
Ang nagbigay ng kulay
Wala sa Iyong maipapantay
Hesus sa buhay ko Ika'y
Kumilos at gumabay
Wala sa Iyong maipapantay

Sa bawat umagang kay ganda
Simulang magpuri sa Kanya
Itaas ang kamay at umawit na
Sa bawat araw na dumaraan
...

",MusixMatch
31,151551019,Wala Kang Katulad,RM Rodriguez,[22],['Christian & Gospel'],"Wala kang katulad

Waka kang katulad,
Wala kang katulad
Wala kang katulad,
O diyos

Sa iyong pag-ibig
At kapangyarihan
Wala kang katulad,
O diyos

Habag na di nagmamaliw
Kapayapaan bilangmang-aaliw
Sa'yong biyaya at
Kaluwalhatian
Wala kang katulad,
O diyos

Waka kang katulad,
Wala kang katulad
...

",MusixMatch
32,77962477,Unang Alay,Lito Magnaye,[22],['Christian & Gospel'],"Kunin at tanggapin ang alay na ito
Mga biyayang nagmula sa pagpapala Mo
Tanda ng bawat pusong 'pagkat inibig Mo
Ngayo'y nananalig, nagmamahal sa 'Yo

Tinapay na nagmula sa butil ng trigo
Pagkaing nagbibigay ng buhay Mo
At alak na nagmula sa isang tangkay ng ubas
Inuming nagbibigay lakas

Kunin at tanggapin ang alay na ito
Mga biyayang nagmula sa pagpapala Mo
Tanda ng bawat pusong 'pagkat inibig Mo
...

",MusixMatch
33,83585090,Salmo 23 (Ang Panginoon Ang Aking Pastol),Lito Magnaye,[22],['Christian & Gospel'],"Ang Panginoon ang aking Pastol
Hindi ako magkukulang
Ako ay Kaniyang pinagpapahinga
Sa mainam Niyang pastulan

Inakay ako sa tahimik na batis
At dulot Niya'y bagong lakas
Tapat sa pangakong
Ako'y sasamahan Niya
Sa tuwid na landas

...

",MusixMatch
34,83086786,Diyos Inibig Mo (Live),Jesus One Generation,[22],['Christian & Gospel'],"Kaluwalhatian, Kataas-taasan
Ikaw ang Panginoon
Kamangha-mangha, kay ganda-ganda
Ikaw ang Panginoon

Binigay Mo ang lahat

Diyos inibig Mo ang isang tulad ko
Tinawag Mong anak, itinabi sa piling Mo
At sa 'Yong mga mata, ako'y malinis na
Katuwiran ni Hesus, Iyong nakikita

Makapangyarihan magpakailanman
Ikaw ang Panginoon
...

",MusixMatch
35,117094564,Sino Ako,Fatima Soriano,"[1204, 22]","['Asia', 'Christian & Gospel']","Hiram sa Dios ang aking buhay
Ikaw at ako'y tanging handog lamang
Di ko ninais na ako'y isilang
Ngunit salamat dahil may buhay

Ligaya ko na ako'y isilang
Pagkat tao ay mayroong dangal
Sinong may pagibig sinong nagmamahal
Kundi ang tao Dios ang pinagmulan

...

",MusixMatch
36,159317757,May Galak,RM Rodriguez,[22],['Christian & Gospel'],"May galak, may saya, may tuwa
Sa piling ng Diyos
Sapagkat hirap ng puso ay naglalaho
May awit, may sayaw, at papuri
Para sa Diyos
Na hatid ng pusong pinagpala Niyang lubos
...

",MusixMatch
37,77315289,Hari Ng Kaluwalhatian,Jesus One Generation,[22],['Christian & Gospel'],"Sa simula
Ikaw ang Salita
Pangalan Mo'y kamang-mangha

Sa kalagitnaan ng unos
Kinalma Mo ang mga alon
At kapayapaan Mo ang dumaloy

Sa simula
Ikaw ang Salita
Pangalan Mo'y kamang-mangha
Sa kalagitnaan ng unos
Kinalma Mo ang mga alon
At kapayapaan Mo ang dumaloy

Ikaw ang Hari ng
...

",MusixMatch
38,192894225,Kapit,Liveloud Worship,[22],['Christian & Gospel'],"Nandito lang ako
Di ko lilisanin
Ang iyong tabi
Kung kakailanganing
Suungin ang bawat hamon
May takot man sa dibdib
Lahat ay may pag-ahon
Ang umaga'y darating
At kung malayo man ang bukas
At mahaba man ang gabi
Kailan ma'y di ka bibitawan
Haharapin ng sabay ang dilim
At babangon nang muli
Kapit lang, at wag kang bibitiw
Nandito lang ako
Hayaan mo't may langit
...

",MusixMatch
39,136863024,Napakabuti Mo (Live),Rommel Guevara,[22],['Christian & Gospel'],"Napakabuti Mo, aking Diyos, Ama
Iyong likha, luluwalhatiin Ka
Napakabuti Mo, 'di Ka nagbabago
Noon, ngayon, kailan pa man
Sa buhay ko'y tapat

Diyos na napakabuti, sa 'Yo ako'y lumalapit
Walang kapantay, pag-ibig mong tunay
Karangalan at papuri, sa 'Yo lamang lahat

Napakabuti Mo, aking Diyos, Ama
Iyong nilikha, luluwalhatiin Ka (napakabuti Mo)
Napakabuti Mo, 'di Ka nagbabago
Noon, ngayon, kailan pa man
Sa buhay ko'y tapat
...

",MusixMatch
40,136863023,Sa Habang Panahon (Live),Rommel Guevara,[22],['Christian & Gospel'],"Panginoon
Sa 'Yo ako ay laging sasamba
Papupurihan Ka
Puso at isipan
Buong lakas at buhay
Aking iaalay sa 'Yo o Diyos

Panginoon
Sa 'Yo ako ay laging sasamba
Papupurihan Ka
Puso at isipan
Buong lakas at buhay
...

",MusixMatch
41,136863021,Kay Buti Mo (Live),Rommel Guevara,[22],['Christian & Gospel'],"Panginoon, kay buti Mo sa akin
Ikaw lamang sasambahin
Aawitan Kita at pupurihin
...

",MusixMatch
42,79505180,Alay Ko'y Pagsamba,Tony Rodeo,[22],['Christian & Gospel'],"ALAY KO'Y PAGSAMBA
Ang buhay ko
Ito ay para lang sa Iyo
Ikaw ang pupurihin Ko,
Aawitan ko at sasambahin

...

",MusixMatch
43,104407835,Ikaw Ang Dahilan,Ron & Joanna Domingo,[22],['Christian & Gospel'],"Ikaw ang dahilan kong bat ang puso ko natotong mag mahal at nag pakatutuo salamat sa pag ibig na binigay mo nandahil sa iyo mundo ko ay nag bago
...

",MusixMatch
44,136863011,Dakila Siya (Live),Rommel Guevara,[22],['Christian & Gospel'],"Ang panginoon ay ating pupurihin
Ang panginoon ay ating dakilain
Walang katulad ang pag-ibig niya
Siya'y laging tapat
Walang kapantay
Ang panginoon
Sa aking buhay
Dakila siya...
Dakila siya...
Dakila siya...
Dakila siya...

Ang panginoon ay ating pupurihin
...

",MusixMatch
45,78391974,Tagapagligtas (Live),Jesus One Generation,[22],['Christian & Gospel'],"Sa piling niya'y ligaya
Puno ng pagpapala
Hinding hindi mangangamba

Lahat ng may problema
Ikaw lang ang pag-asa
Wala nang di makakaya
Ikaw Hesus ang pag-asa

Ikaw ang Tagapagligtas
At tagapagtanggol
Ng Aking buhay sa buhay ko
Di na ako mangangamba
O matatakot
Pagkat ikaw ang kasama

Hesus ikaw na nga ang
Diyos na mapagpatawad
Dugo mo ang pinambayad

Sa amin ika'y lumapit
Tinanggap ang pasakit
Kami ngayon ay lalapit
Ako ngayon ay lalapit

Ikaw ang Tagapagligtas
At tagapagtanggol
Ng Aking buhay sa buhay ko
Di na ako mangangamba
O matatakot
Pagkat ikaw ang kasama ko

Noong wala sayo o kay gulo
Ngunit minahal mo na at iningatan pa
Ngayon ay magkasama
wala nang hahanapin pa
Hahanapin pa

Ikaw ang Tagapagligtas
At tagapagtanggol
Ng Aking buhay sa buhay ko
Di na ako mangangamba
O matatakot
Pagkat ikaw ang kasama

Ikaw ang Tagapagligtas
At tagapagtanggol
Ng Aking buhay sa buhay ko
Di na ako mangangamba
O matatakot
Pagkat ikaw ang kasama ko",
46,136863006,Uulan Ng Pagpapala (Live),Rommel Guevara,[22],['Christian & Gospel'],"Kung kami ay luluhod
At sa Iyo ay sasamba
Kami ay Iyong diringgin
At ang bayang ito'y
Inyong pagagalingin

Uulan ng pagpapala
Uulan ng pagpapala
Uulan ng pagpapala
Sa bayang ito, O Diyos
O Diyos!

Sa Iyong kabutihan,
Kami ngayo'y Iyong bayan
Pinili at inalagaan
...

",MusixMatch
47,74789950,Awit Ng Pasasalamat Sa Ama't Ina,Musikatha Kids,[22],['Christian & Gospel'],"Kaybuti ng Panginoon
Ang tulad ko'y binigyan N'ya ng buhay, napuno ng kulay
Wala na akong mahihiling
Dahil sa handog Niyang walang katulad na mga magulang

Kapag ako'y nalulumbay, handa akong kalingain
Kapag ako'y nagkukulang, unawa ang laan sa 'kin

Salamat sa Panginoon 'pagka't binigyan N'ya ako
Ng mga magulang na lubos-lubos ang pagsinta
...

",MusixMatch
48,159317759,Salamat Salamat,RM Rodriguez,[22],['Christian & Gospel'],"Kung ating mamasdan
Ang kalawakan
Hindi ko maunawaan
Ang 'yong dahilan
Kung bakit ako'y
Pinili mo't inalagaan
Diko kayang isipin
Hinding hindi ko kayang sukatin
Ang pag ibig mo Hesus
Na 'yong binigay sa akin
Salamat salamat
O Hesus sa pag ibig mo
Walang ibang nagmahal sakin ng katulad mo
Salamat salamat
O Hesus sa pag ibig mo
Ako'y magsasaya
Sa piling mo
...

",MusixMatch
49,79505189,Sa Diyos Walang Imposible,Tony Rodeo,[22],['Christian & Gospel'],"Hanap mo ba'y kagalingan sa karamdaman
Pagod kna b, sa problemang dinadala
Nais mo ba na a
Ung buhay na mapayapa
Ang landas mo ay nais mong itama

...

",MusixMatch
